date,company,sector,update_type,headline,detail
2026-04-15,Helix Health Systems,Healthcare IT,KPI,Q1 ARR +52% YoY,Crossed $80M ARR; signed 3 new health-system contracts including regional IDN expansion
2026-04-22,Veridian AI,AI Infrastructure,Markup,Series D at $4.2B valuation,Led by tier-1 strategic; previous round was $2.8B 14 months ago
2026-05-02,Stratus Logistics,Vertical SaaS (logistics),KPI,NRR climbed to 138%,Expansion within top 20 accounts; lower mid-market churn improved
2026-05-08,Northforge Energy,Climate Tech,New Deal,Closed Series B led by us,APAC-headquartered carbon capture platform; first deployment in Singapore
2026-04-29,Clearwell Analytics,Healthcare IT,Regulatory,Achieved HITRUST certification,Unlocks enterprise health-system buyers; CFO indicated 40% pipeline acceleration
2026-05-12,Arclight Robotics,Industrial AI,Markdown,Reduced fair value by 22%,Slower enterprise sales cycle; extended runway to 24 months via insider round
2026-05-18,Pinecrest Compliance,Vertical SaaS (regtech),KPI,Logo count +18 in Q1,Mid-market focus; CAC payback improved to 11 months
2026-04-30,Solas Renewables,Climate Tech,Exit Activity,Initiated S-1 process,Target IPO window late 2026; would be fund's largest realization to date
